{
  "$schema": "https://mcp-manifest.dev/schema/v1.0.json",
  "version": "1.0",
  "server": {
    "name": "my-server",
    "displayName": "My MCP Server",
    "description": "A minimal example manifest",
    "version": "1.0.0"
  },
  "install": [
    {
      "method": "npm",
      "package": "my-mcp-server",
      "command": "my-mcp-server",
      "priority": 0
    }
  ],
  "transport": "stdio"
}
