{
  "$schema": "https://mcp-manifest.dev/schema/v1.0.json",
  "version": "1.0",
  "server": {
    "name": "github",
    "displayName": "GitHub",
    "description": "GitHub API integration — manage repos, issues, PRs, and more",
    "version": "0.6.0",
    "author": "Anthropic",
    "homepage": "https://github.com",
    "repository": "https://github.com/anthropics/mcp-servers",
    "license": "MIT",
    "icon": "https://github.githubassets.com/favicons/favicon.svg",
    "keywords": ["github", "git", "code", "issues", "pull-requests"]
  },
  "install": [
    {
      "method": "npm",
      "package": "@anthropic/mcp-server-github",
      "command": "mcp-server-github",
      "priority": 0
    }
  ],
  "transport": "stdio",
  "config": [
    {
      "key": "github-token",
      "description": "GitHub personal access token",
      "type": "secret",
      "required": true,
      "env_var": "GITHUB_TOKEN",
      "prompt": "GitHub personal access token (ghp_...)",
      "secret_target": "api.github.com",
      "secret_scope_url": "https://api.github.com/*"
    }
  ],
  "scopes": ["global"],
  "settings_template": {
    "command": "mcp-server-github",
    "args": []
  }
}
