{
  "$schema": "https://mcp-manifest.dev/schema/v1.0.json",
  "version": "1.0",
  "server": {
    "name": "ironlicensing",
    "displayName": "IronLicensing",
    "description": "Manage IronLicensing products, tiers, features, licenses, and analytics via AI assistants",
    "version": "1.0.0",
    "author": "IronServices",
    "homepage": "https://www.ironlicensing.com",
    "repository": "https://git.marketally.com/IronServices/ironlicensing-mcp",
    "license": "MIT",
    "icon": "https://www.ironlicensing.com/favicon.svg",
    "keywords": ["licensing", "saas", "product-management", "analytics", "tiers", "features"]
  },
  "install": [
    {
      "method": "dotnet-tool",
      "package": "IronLicensing.Mcp",
      "registry": "https://git.marketally.com/api/packages/ironservices/nuget/index.json",
      "command": "ironlicensing-mcp",
      "priority": 0
    }
  ],
  "transport": "stdio",
  "config": [
    {
      "key": "profile",
      "description": "Named account profile from ~/.ironlicensing/config.json",
      "type": "string",
      "required": false,
      "arg": "--profile",
      "prompt": "Account profile (leave empty for default)",
      "options_from": {
        "file": "~/.ironlicensing/config.json",
        "path": "$.accounts[*].name"
      }
    },
    {
      "key": "api-key",
      "description": "IronLicensing API key (sk_live_xxx) from /app/settings/api-keys",
      "type": "secret",
      "required": false,
      "env_var": "IRONLICENSING_API_KEY",
      "arg": "--api-key",
      "prompt": "API key (or configure via add_account tool after connecting)",
      "secret_target": "api.ironlicensing.com",
      "secret_scope_url": "https://api.ironlicensing.com/*"
    },
    {
      "key": "base-url",
      "description": "IronLicensing API base URL",
      "type": "url",
      "required": false,
      "default": "https://api.ironlicensing.com",
      "env_var": "IRONLICENSING_BASE_URL",
      "arg": "--base-url",
      "prompt": "API base URL"
    }
  ],
  "scopes": ["global"],
  "settings_template": {
    "command": "ironlicensing-mcp",
    "args": ["--profile", "${profile}"]
  },
  "update_policy": "ask",
  "changelog_url": "https://www.ironlicensing.com/mcp/changelog"
}
